<?xml version="1.0"?>
<!--
  ~ org.riverock.commerce - Commerce application
  ~
  ~ Copyright (C) 2006, Riverock Software, All Rights Reserved.
  ~
  ~ Riverock - The Open-source Java Development Community
  ~ http://www.riverock.org
  ~
  ~
  ~ This program is free software; you can redistribute it and/or
  ~ modify it under the terms of the GNU General Public
  ~ License as published by the Free Software Foundation; either
  ~ version 2 of the License, or (at your option) any later version.
  ~
  ~ This library is distributed in the hope that it will be useful,
  ~ but WITHOUT ANY WARRANTY; without even the implied warranty of
  ~ MERCHANTABILITY or FITNESS FOR A PARTICULAR PURPOSE. See the GNU
  ~ General Public License for more details.
  ~
  ~ You should have received a copy of the GNU General Public
  ~ License along with this library; if not, write to the Free Software
  ~ Foundation, Inc., 59 Temple Place, Suite 330, Boston, MA 02111-1307 USA
  -->
<mill:binding xmlns:mill="http://www.castor.org/SourceGenerator/Binding" xmlns:xsi="http://www.w3.org/2001/XMLSchema-instance" xsi:schemaLocation="http://www.castor.org/SourceGenerator/Binding
../xsd/castor-binding.xsd" defaultBindingType="type">
	<package>
		<name>org.riverock.sso.schema</name>
		<namespace>http://sso.riverock.org/xsd/riverock-sso.xsd</namespace>
	</package>
	<package>
		<name>org.riverock.sso.schema.core</name>
		<namespace>http://sso.riverock.org/xsd/riverock-sso-core.xsd</namespace>
	</package>
	<package>
		<name>org.riverock.webmill.schema.core</name>
		<namespace>http://webmill.riverock.org/xsd/riverock-webmill-core.xsd</namespace>
	</package>
	<package>
		<name>org.riverock.generic.schema.db.structure</name>
		<namespace>http://generic.riverock.org/xsd/riverock-database-structure.xsd</namespace>
	</package>
	<package>
		<name>org.riverock.portlet.schema.core</name>
		<namespace>http://portlet.riverock.org/xsd/riverock-portlet-schema-core.xsd</namespace>
	</package>
	<package>
		<name>org.riverock.interfaces.schema.javax.portlet</name>
		<namespace>http://java.sun.com/xml/ns/portlet/portlet-app_1_0.xsd</namespace>
	</package>
</mill:binding>
